{
  "type": "adspilot.commissions",
  "schema_version": 1,
  "network": "cj",
  "publisher_id": "1234567",
  "currency": "USD",
  "pulled_at": "2026-09-21T02:00:00Z",
  "window": {
    "since": "2026-09-01",
    "until": "2026-09-21"
  },
  "rows": [
    {
      "event_id": "cj-evt-0001",
      "event_time": "2026-09-11T03:12:44Z",
      "click_time": "2026-09-10T14:03:00Z",
      "sub_id": "FIXTURETOKEN00000001",
      "status": "new",
      "amount": 18.4,
      "sale_amount": 92.0,
      "currency": "USD",
      "advertiser": "Brand X",
      "advertiser_id": "100001",
      "offer_ref": "cj:100001:12345",
      "action": "sale",
      "is_chargeback": false
    },
    {
      "event_id": "cj-evt-0002",
      "event_time": "2026-09-13T11:00:00Z",
      "click_time": "2026-09-12T09:30:00Z",
      "sub_id": "FIXTURETOKEN00000002",
      "status": "locked",
      "amount": 7.5,
      "sale_amount": 50.0,
      "currency": "USD",
      "advertiser": "Brand Y",
      "advertiser_id": "100002",
      "offer_ref": "cj:100002:12346",
      "action": "sale",
      "is_chargeback": false
    },
    {
      "event_id": "cj-evt-0003",
      "event_time": "2026-09-16T08:00:00Z",
      "sub_id": "",
      "status": "new",
      "amount": 3.0,
      "currency": "USD",
      "advertiser": "Brand Q",
      "advertiser_id": "100009",
      "action": "sale",
      "is_chargeback": false
    },
    {
      "event_id": "cj-evt-0004",
      "event_time": "2026-09-18T10:00:00Z",
      "sub_id": "FIXTURETOKEN00000002",
      "status": "reversed",
      "amount": -7.5,
      "currency": "USD",
      "advertiser": "Brand Y",
      "advertiser_id": "100002",
      "offer_ref": "cj:100002:12346",
      "action": "sale",
      "is_chargeback": true,
      "original_event_id": "cj-evt-0002"
    }
  ]
}